{
  "spec_version": "0.1",
  "source_prompt": "Mutation Funk、DUB、Tech House。110 BPM、D#m。0.25分程度。ファンキーなスラップベース。サイケデリック、インストゥルメンタル。実機スモークテスト。",
  "seed": 8,
  "song": {
    "title": "Mutation Signal",
    "bpm": 110.0,
    "key": "D# minor",
    "tonic": "D#",
    "tonic_pitch_class": 3,
    "mode": "minor",
    "time_signature": "4/4",
    "total_bars": 8,
    "target_duration_sec": 17.455
  },
  "style": {
    "genres": [
      {
        "name": "mutation_funk",
        "weight": 0.4
      },
      {
        "name": "dub",
        "weight": 0.3
      },
      {
        "name": "tech_house",
        "weight": 0.3
      }
    ],
    "darkness": 0.72,
    "psychedelic": 0.82
  },
  "groove": {
    "swing": 0.54,
    "syncopation": 0.82,
    "humanize": 0.18
  },
  "arrangement": [
    {
      "name": "minimal_intro",
      "start_bar": 0,
      "length_bars": 2,
      "energy": 0.25,
      "minimal": false,
      "psychedelic": 0.08,
      "bass_density": 0.18,
      "drum_density": 0.45,
      "chord_density": 0.15,
      "fx_amount": 0.3,
      "vocal_probability": 0.0,
      "mutation": 0.15
    },
    {
      "name": "minimal_groove",
      "start_bar": 2,
      "length_bars": 2,
      "energy": 0.44,
      "minimal": false,
      "psychedelic": 0.18,
      "bass_density": 0.52,
      "drum_density": 0.62,
      "chord_density": 0.32,
      "fx_amount": 0.35,
      "vocal_probability": 0.2,
      "mutation": 0.28
    },
    {
      "name": "mutation_build",
      "start_bar": 4,
      "length_bars": 2,
      "energy": 0.66,
      "minimal": false,
      "psychedelic": 0.58,
      "bass_density": 0.7,
      "drum_density": 0.82,
      "chord_density": 0.55,
      "fx_amount": 0.62,
      "vocal_probability": 0.45,
      "mutation": 0.7
    },
    {
      "name": "psychedelic_drop",
      "start_bar": 6,
      "length_bars": 2,
      "energy": 0.88,
      "minimal": false,
      "psychedelic": 0.96,
      "bass_density": 1.0,
      "drum_density": 0.92,
      "chord_density": 0.66,
      "fx_amount": 0.7,
      "vocal_probability": 0.6,
      "mutation": 0.88
    }
  ],
  "harmony": {
    "progression": [
      "D#m",
      "B",
      "F#",
      "C#"
    ],
    "harmonic_rhythm_bars": 1
  },
  "bass": {
    "role": "dominant",
    "technique": "slap",
    "syncopation": 0.86,
    "mutation": 0.78,
    "octave_jump_probability": 0.45,
    "ghost_note_probability": 0.34
  },
  "drums": {
    "pattern": "syncopated_tech_house",
    "kick_density": 0.72,
    "hat_density": 0.78,
    "dub_space": 0.62
  },
  "chords": {
    "instrument": "dub_chord_stab",
    "articulation": "short_offbeat_stabs",
    "dub_delay": 0.74
  },
  "vocal": {
    "enabled": false,
    "vocoder": false,
    "character": "none"
  }
}
