{
  "spec_version": "0.1",
  "source_prompt": "アンビエント。110 BPM、D#m。2分程度。きらびやかで高域中心、繊細。ベースは控えめで薄い。パーカッションは軽く、シェイカーとハイハット中心。インストゥルメンタル。",
  "seed": 8,
  "song": {
    "title": "KIHACHI Sketch",
    "bpm": 110.0,
    "key": "D# minor",
    "tonic": "D#",
    "tonic_pitch_class": 3,
    "mode": "minor",
    "time_signature": "4/4",
    "total_bars": 56,
    "target_duration_sec": 122.182
  },
  "style": {
    "genres": [
      {
        "name": "ambient",
        "weight": 1.0
      }
    ],
    "darkness": 0.48,
    "psychedelic": 0.333
  },
  "groove": {
    "swing": 0.5,
    "syncopation": 0.58,
    "humanize": 0.35
  },
  "arrangement": [
    {
      "name": "minimal_intro",
      "start_bar": 0,
      "length_bars": 8,
      "energy": 0.25,
      "minimal": false,
      "psychedelic": 0.08,
      "bass_density": 0.18,
      "drum_density": 0.45,
      "chord_density": 0.15,
      "fx_amount": 0.3,
      "vocal_probability": 0.0,
      "mutation": 0.15
    },
    {
      "name": "minimal_groove",
      "start_bar": 8,
      "length_bars": 16,
      "energy": 0.44,
      "minimal": false,
      "psychedelic": 0.18,
      "bass_density": 0.52,
      "drum_density": 0.62,
      "chord_density": 0.32,
      "fx_amount": 0.35,
      "vocal_probability": 0.2,
      "mutation": 0.28
    },
    {
      "name": "mutation_build",
      "start_bar": 24,
      "length_bars": 16,
      "energy": 0.66,
      "minimal": false,
      "psychedelic": 0.58,
      "bass_density": 0.7,
      "drum_density": 0.82,
      "chord_density": 0.55,
      "fx_amount": 0.62,
      "vocal_probability": 0.45,
      "mutation": 0.7
    },
    {
      "name": "psychedelic_drop",
      "start_bar": 40,
      "length_bars": 16,
      "energy": 0.88,
      "minimal": false,
      "psychedelic": 0.58,
      "bass_density": 1.0,
      "drum_density": 0.92,
      "chord_density": 0.66,
      "fx_amount": 0.7,
      "vocal_probability": 0.6,
      "mutation": 0.88
    }
  ],
  "harmony": {
    "progression": [
      "D#m",
      "D#m",
      "C#",
      "C#"
    ],
    "harmonic_rhythm_bars": 4
  },
  "bass": {
    "role": "supporting",
    "technique": "fingered",
    "syncopation": 0.58,
    "mutation": 0.35,
    "octave_jump_probability": 0.18,
    "ghost_note_probability": 0.12
  },
  "drums": {
    "pattern": "sparse_pulse",
    "kick_density": 0.18,
    "hat_density": 0.15,
    "dub_space": 0.2
  },
  "chords": {
    "instrument": "synth_chord",
    "articulation": "sustained_pads",
    "dub_delay": 0.18
  },
  "vocal": {
    "enabled": false,
    "vocoder": false,
    "character": "none"
  }
}
